{
  "model": 1,
  "product": {
    "id": "commerce",
    "outcome": "Choose a small-batch piece, inspect the maker’s terms, and pay once with an order reference that survives an uncertain payment response.",
    "archetype": "commerce",
    "users": [
      {
        "id": "buyer",
        "who": "A buyer comparing small-batch goods and checking delivery from a phone or laptop.",
        "device": "both",
        "surfaces": [
          "shop",
          "goodsDetail",
          "checkout",
          "orders",
          "makerThread",
          "saved",
          "settings",
          "help",
          "landing",
          "emailOrderShipped",
          "pushPriceChanged"
        ]
      }
    ]
  },
  "entities": [
    {
      "id": "goods",
      "contract": "Goods",
      "words": [
        "piece",
        "goods"
      ],
      "never": [
        "listing",
        "product"
      ]
    },
    {
      "id": "order",
      "contract": "Order",
      "words": [
        "order",
        "parcel"
      ],
      "never": [
        "booking"
      ]
    },
    {
      "id": "checkoutDetails",
      "contract": "Checkout",
      "words": [
        "delivery details",
        "payment attempt"
      ],
      "never": [
        "goods editor"
      ]
    }
  ],
  "capabilities": [
    {
      "id": "purchaseGoods",
      "real": true,
      "note": "The invented shop accepts one piece per checkout and returns a durable order reference."
    },
    {
      "id": "checkPaymentStatus",
      "real": true,
      "note": "A payment attempt is idempotent and its result can be checked without charging again."
    },
    {
      "id": "savePieces",
      "real": true,
      "note": "Buyers can save a piece and later revisit its current terms."
    },
    {
      "id": "sendMessages",
      "real": true,
      "note": "Maker messages are persisted before a sent acknowledgement appears."
    },
    {
      "id": "savePreferences",
      "real": true,
      "note": "Shopping preferences persist independently of an order."
    },
    {
      "id": "shippingUpdates",
      "real": true,
      "note": "A shipping email is sent only after a parcel tracking reference is recorded."
    },
    {
      "id": "priceAlerts",
      "real": true,
      "note": "An opted-in buyer is notified when the saved piece’s price changes."
    },
    {
      "id": "makerOnboarding",
      "real": false,
      "note": "Opening a maker shop is not part of the buyer contract; no seller-registration control is rendered."
    }
  ],
  "data": {
    "Goods": {
      "fields": {
        "name": "text",
        "maker": "text",
        "description": "longText",
        "price": "money",
        "category": "text",
        "availability": "enum",
        "rating": "number",
        "image": "image",
        "imageAlt": "text"
      },
      "typical": 12,
      "max": 600,
      "long": [
        "name",
        "description"
      ],
      "enums": {
        "availability": [
          "available",
          "madeToOrder",
          "soldOut"
        ]
      }
    },
    "Order": {
      "fields": {
        "reference": "text",
        "goods": "ref",
        "name": "text",
        "maker": "text",
        "status": "enum",
        "total": "money",
        "deliveryCost": "money",
        "giftWrapCost": "money",
        "createdAt": "date",
        "trackingReference": "text",
        "subtotal": "money"
      },
      "typical": 6,
      "max": 60,
      "long": [
        "name"
      ],
      "enums": {
        "status": [
          "shipped",
          "delivered",
          "packing",
          "delayed",
          "refunded",
          "awaitingPayment"
        ]
      }
    },
    "Message": {
      "fields": {
        "author": "text",
        "text": "longText",
        "mine": "enum",
        "sentAt": "date"
      },
      "typical": 4,
      "max": 500,
      "long": [
        "author",
        "text"
      ],
      "enums": {
        "mine": [
          "mine",
          "theirs"
        ]
      }
    },
    "Checkout": {
      "fields": {
        "recipientName": "text",
        "addressText": "longText",
        "email": "text",
        "delivery": "enum",
        "giftWrap": "enum",
        "trackingUpdates": "enum",
        "paymentLastFour": "text",
        "attemptReference": "text"
      },
      "typical": 1,
      "max": 1,
      "long": [
        "recipientName",
        "addressText"
      ],
      "enums": {
        "delivery": [
          "standard",
          "express",
          "collection"
        ],
        "giftWrap": [
          "yes",
          "no"
        ],
        "trackingUpdates": [
          "yes",
          "no"
        ]
      }
    }
  },
  "states": {
    "shopReady": {
      "label": "Available pieces",
      "rule": "Show maker, price and availability on each card; buying begins only after the piece is inspected.",
      "kind": "data",
      "fixtures": {
        "Goods": "populated"
      }
    },
    "shopLoading": {
      "label": "Refreshing pieces",
      "rule": "Keep the last assortment and the current filters visible while refreshing; do not claim new stock has arrived.",
      "kind": "data",
      "fixtures": {
        "Goods": "populated"
      }
    },
    "shopEmpty": {
      "label": "No matching pieces",
      "rule": "Keep the query and selected filters so the buyer can clear them rather than starting an unrelated task.",
      "kind": "firstRun",
      "fixtures": {
        "Goods": "none"
      }
    },
    "shopFailed": {
      "label": "Shop unavailable",
      "rule": "Show that the assortment could not be retrieved and retry without changing the buyer’s filters.",
      "kind": "data",
      "fixtures": {
        "Goods": "none"
      }
    },
    "shopLongContent": {
      "label": "Long maker descriptions",
      "rule": "Wrap the print’s complete edition name and material description without hiding its maker or price.",
      "kind": "data",
      "fixtures": {
        "Goods": "long"
      }
    },
    "shopSoldOut": {
      "label": "Sold-out piece",
      "rule": "Retain the piece’s identity and show Sold out; inspection is available but payment is not.",
      "kind": "data",
      "fixtures": {
        "Goods": "soldOut"
      }
    },
    "goodsDetailReady": {
      "label": "Piece available",
      "rule": "Show the selected piece and maker, then the delivery and return terms; Buy opens the final checkout review.",
      "kind": "data",
      "fixtures": {
        "Goods": "one"
      }
    },
    "goodsDetailLoading": {
      "label": "Refreshing piece",
      "rule": "Keep the selected piece visible while checking its current price and stock; withhold Buy until refreshed.",
      "kind": "data",
      "fixtures": {
        "Goods": "one"
      }
    },
    "goodsDetailEmpty": {
      "label": "Piece removed",
      "rule": "Show that this piece is no longer listed and return to the shop without inventing a replacement.",
      "kind": "data",
      "fixtures": {
        "Goods": "none"
      }
    },
    "goodsDetailFailed": {
      "label": "Piece unavailable",
      "rule": "Explain a retrieval failure, not a card decline; do not offer payment while the maker’s terms cannot be read.",
      "kind": "data",
      "fixtures": {
        "Goods": "none"
      }
    },
    "goodsDetailLongContent": {
      "label": "Long piece details",
      "rule": "Wrap the complete print edition name and maker’s care description before the buying action.",
      "kind": "data",
      "fixtures": {
        "Goods": "long"
      }
    },
    "goodsDetailSoldOut": {
      "label": "Sold out",
      "rule": "Show the sold-out piece and its maker’s terms with no Buy action.",
      "kind": "data",
      "fixtures": {
        "Goods": "soldOut"
      }
    },
    "goodsDetailMadeToOrder": {
      "label": "Made to order",
      "rule": "Explain that the serving bowl is made to order and that its cancellation window closes when work starts.",
      "kind": "data",
      "fixtures": {
        "Goods": "madeToOrder"
      }
    },
    "goodsDetailSavingPiece": {
      "label": "Saving piece",
      "rule": "Keep the piece visible and prevent a duplicate save until the saved list accepts it.",
      "kind": "operation",
      "fixtures": {
        "Goods": "one"
      }
    },
    "goodsDetailPieceSaved": {
      "label": "Piece saved",
      "rule": "Confirm that the piece is now in Saved and keep its buying terms available.",
      "kind": "operation",
      "fixtures": {
        "Goods": "one"
      }
    },
    "goodsDetailSaveFailed": {
      "label": "Save failed",
      "rule": "Keep the piece visible and offer another save without implying a purchase failed.",
      "kind": "operation",
      "fixtures": {
        "Goods": "one"
      }
    },
    "checkoutEditable": {
      "label": "Editable",
      "rule": "Show the reserved piece, delivery form, selected card and exact final total. Paying submits one idempotent payment attempt.",
      "kind": "data",
      "fixtures": {
        "Goods": "one",
        "Order": "quote",
        "Checkout": "blankDetails"
      }
    },
    "checkoutPaying": {
      "label": "Paying",
      "rule": "Keep the reviewed summary and delivery details read-only. Replace Pay with payment progress and prevent a second charge.",
      "kind": "operation",
      "fixtures": {
        "Goods": "one",
        "Order": "quote",
        "Checkout": "one"
      }
    },
    "checkoutDeclined": {
      "label": "Card declined",
      "rule": "State that the provider rejected payment, retain all delivery values, and let the buyer select another card before trying again.",
      "kind": "operation",
      "fixtures": {
        "Goods": "one",
        "Order": "quote",
        "Checkout": "one"
      }
    },
    "checkoutUnknown": {
      "label": "Payment outcome unknown",